Company name,URL,Email,Tel
บริษัท เค.บี. แคปปิตอล จำกัด,https://kbcapital.co.th/,kb@kbcapital.co.th,097-1351305
บริษัท เครื่องสำอางไฟโบรอิน (ไทยแลนด์) จำกัด,https://www.beautyplus-fibroin.com/,fibroinbp@gmail.com,02-1369298
บริษัท เงินเฮง จำกัด,https://www.ngernheng.com/,Ngernheng2021@gmail.com,02-2486888
บริษัท เงินยินดี จำกัด,https://www.ngernyindee.co.th/,,02-2795596
บริษัท เงินสดใจดี จำกัด,https://ngernsodjaidee.com/,info@moneyjaidee.com,02-5414642
บริษัท เชียงใหม่ เฮอริเทจ จำกัด,http://www.t-heritagehotel.com,info@t-heritagehotel.com,053-282686
บริษัท เซฟ เวลเนส จำกัด,https://www.thefountainwellnesscenter.com/th/home,info@safe-wellness.com,02-2569833
บริษัท เซิ่งเสียนอุตสาหกรรม (ประเทศไทย)  จำกัด,http://th.shengxianthailand.com/,,037-629571
บริษัท เดอะ ลอร์ด เนลสัน จำกัด,https://www.lordnelsonthailand.com/,thelordnelson@outlook.co.th,033-650945
บริษัท เทคโนโลยีฟลายเบิร์ด จำกัด,https://flybird.co.th/,flybird@flybird.co.th,02-1150277
บริษัท เน็คซ์ มันนี่ จำกัด,https://nextmoney.co.th/,cs@nextmoney.co.th,02-3429666
บริษัท เน็ตดีไซน์ พารากอน จำกัด,https://netdesign.ac.th/,,080-2093454
บริษัท เนสโทปา จำกัด,https://nestopa.com/,info@nestopa.com,064-5407000
บริษัท เบนนิค อิเล็กทรอนิกส์ (ไทยแลนด์) จำกัด,https://www.bennic.com.tw/th/profile.asp,tpben@bennic.co.th,037-267261
บริษัท เมดพาร์คไอวีเอฟ จำกัด,https://www.medparkhospital.com/contact-us,access@medparkhospital.com,02-0233333
บริษัท เอ ทู แซด อินเตอร์เนชั่นแนล ทราเวลส์  จำกัด,www.a2ztravelthai.com,a2ztravelthai@gmail.com,088-2092448
บริษัท เอเอ็มที แคปปิตอล จำกัด,https://www.amtcapital.co.th/,info@amtcapital.co.th,02-8215414
บริษัท เอ็น - ลาร์จ พร็อพเพอร์ตี้ จำกัด,https://nlargeproperty.com/,NLargePPT@gmail.com,080-611-9222 
บริษัท เอ-วอท โฮลดิ้ง (ไทยแลนด์) จำกัด,https://www.awotglobal.com/,marketing.th@awotglobal.com,02-1717692-5
บริษัท เออร์เซน (ประเทศไทย) จำกัด,https://www.aerzenrentalth.com/,Thai@aerzenrental.com,098-3232626
บริษัท แคนเนติกซ์ เอเชีย จำกัด,www.canneticz.com,info@canneticz.com,087-7989544
บริษัท แคนบิซ จำกัด,https://canbis.co.th/,canbiscompany@gmail.com,081-9206076
บริษัท แคลมิกซ์ จำกัด,https://www.calmix.com/,sales@calmix.com,036-674017
บริษัท แซม อี. โฮเทล จำกัด,https://samehotelbkk.com/contact/,reservation@sam-ehotel.com,02-1012623
บริษัท แนทูรา ฮาร์เวสท์ จำกัด,https://www.naturaharvest.com,info@naturaharvest.com,"081-9144766"
บริษัท แบรทบ๊อกซ์ จำกัด,http://bratbox.lnwshop.com/,hello@bratboxsausage.com,092-9868999
บริษัท แฟรคชั่น (ประเทศไทย) จำกัด,https://fraction.co/th/contact.html,,02-0786787
บริษัท แลดูปราณ จำกัด,www.lairdupran.com,lairdupran.sales@gmail.com,032-900480
บริษัท แสงรุ้ง เอ็ดดูเคชั่น จำกัด,https://saengroong.com/,saengroongbooks.online@gmail.com,02-4594711-7
บริษัท แอเรีย ว้าว จำกัด,https://www.tooktee.com/,support@tooktee.com,02-2953905
บริษัท แอควาวิท กรีล แอนด์ บาร์ จำกัด,https://akvavitjomtien.com/,pelle@akvavitjomtien.com,038-233672
บริษัท แองโกล-ดัช (ไทยแลนด์) จำกัด,http://anglo-dutch.co.th/,info@anglo-dutch.co.th,02-2854837-9
บริษัท แอนฟิลด์ เฮง เฮง กรุ๊ป จำกัด,www.anfield 999.com,anfield.peem@gmail.com,055-481827
บริษัท แอสเซท โปร กรุ๊ป จำกัด,https://assetprogroup.co/,info@assetprogroup.co,093-8302222
บริษัท โกลเด้น เทคโนโลยี อินเตอร์เทรด จำกัด,https://www.golden-tech.co.th/,admin@golden-tech.co.th,02-1650604
บริษัท โกลเบน เอ็นจิเนียริ่ง จำกัด,https://globeneng.com/,sales@globeneng.com,02-4125713
บริษัท โกลบอล เทรนด์ แฮนด์คราฟต์ จำกัด,https://www.gthandcraft.com/,hr@gthandcraft.com,02-1270077
บริษัท โปรแอคท์ เขาใหญ่ จำกัด,https://montevistakhaoyai.com/,info@staging.montevistakhaoyai.com,02-5124640
บริษัท โอเรียนทอล ไซ-แอม ไบค์ เทรดดิ้ง (ประเทศไทย) จำกัด,http://www.cycambike.com/contact.php,info@cycambike.com,02-3313169
บริษัท ไซแอนทิส แล็บบอราทอรี อินเตอร์เนชันแนล จำกัด,https://www.scli.co.th/about,biobanking@scli.co.th,064-6298791
บริษัท ไดเมนชั่น แคลิเบรชั่น เซ็นเตอร์ จำกัด,https://www.dcccallab.com/,dcc_cs@hotmail.com,038-789801-5 
บริษัท ไท เซียง เย้า จำกัด,https://www.tcmi-th.com/,waiting@mg-cmi.com.tw,033-002881-2
บริษัท ไทย สเตอเจียน ฟาร์ม จำกัด,https://sturgeon.co.th/contacts/,alex@sturgeon.co.th,083-2926757
บริษัท ไอแอนด์ไอ เวนเจอร์ จำกัด,https://www.iiv.co.th/th/,hi@iiv.co.th,02-2483745
บริษัท ไฮคิก จำกัด,https://highkick.co.th/,contact@highkick.global,062-6186789
บริษัท กระจายบุญ จำกัด,https://krajaiboon.com/,Krajaiboon@gmail.com,063-3510011
บริษัท กราซิโอซ่า จำกัด,https://graziosath.com/,graziosathailand@gmail.com,064-4678844
บริษัท กริส คอลเล็คชั่น จำกัด,https://kriscollection.com/,kris_collection@hotmail.com,084-8770812
บริษัท กำปั้นมวยไทย จำกัด,https://gumpunmuaythai.club/,gumpun@gumpunmuaythai.club,095-9205797
บริษัท กู๊ดวิว มีเดีย พลัส จำกัด,www.gvmp.co.th/,info.goodview@gmail.com,062-7896594
บริษัท คอนฟิเดียร์ พอส จำกัด,https://news.confidia.co.th/,support@confidia.co.th,02-1070566
บริษัท คอนสเท็นซี่ จอมเทียน พัทยา  จำกัด,http://www.constancypattaya.com/,tjjomtienpattaya@gmail.com,065-9780234
บริษัท คอมเมอร์เชี่ยล ฟิล์มส์ ไซแอ็ม จำกัด,https://contentthailand.com/,paul@films.in.th,087-0000795
บริษัท คัยโกเฮาส์ จำกัด,https://www.kaigohouse.co.th/th,info@kaigohouse.co.th,02-1070918
บริษัท คิซโทเปีย เซ็นทรัล เวสต์วิลล์ จำกัด,https://kiztopia.co.th/,hello@kiztopia.co.th,063-9159634
บริษัท จัสท์ กู๊ด ไทม์ จำกัด,www.justgoodtime.co,justgoodtime.th@gmail.com,081-5425965
บริษัท จินหนาน ไอรอน แอนด์ สตีล (ไทยแลนด์) จำกัด,www.jinnansteelthailand.com,jinnaniron888@gmail.com,02-0012639
บริษัท ซาเวียโก จำกัด,www.zaviago.com,service@zaviago.com,064-8236459
บริษัท ซาโล เทค (ไทยแลนด์) จำกัด,https://www.salotechthailand.com/th,,033-014861-3
บริษัท ซีเนร่า ซีเนียร์ เวลเนส จำกัด,https://www.senerawellness.com/,senera@jasasset.co.th,02-1207437
บริษัท ซุปเปอร์ เอ็กซ์ โทเคน จำกัด,https://superxtoken.com/,admin@superxtoken.com,02-3669250-69
บริษัท ด็อกเตอร์ เชน เซอร์เจอรี่ ฮอสพิทอล จำกัด,https://drchenhospital.com/,Info@drchenhospital.com,02-1031723
บริษัท ดีที ฟู๊ด ซัพพลาย แมเนจเม้นท์ จำกัด,https://cqk-group.com/,ciqikou.bkk@gmail.com,097-7507777
บริษัท ทรัพย์ถาวร ไบโอแมส จำกัด,www.stwbiomass.co.th,stwbiomass@outlook.com,085-5455888
บริษัท ที.วาย.ฮอลิเดย์ จำกัด,https://www.tyholiday.com/,tyholidayresort@gmail.com,063-6969191
บริษัท ทีเอ็นอาร์ ไบโอไซเอินซ์ จำกัด,https://www.tnrbioscience.com/,info@tnrbioscience.com,038-342555
บริษัท ทีซีพี อินคิวเบเตอร์ จำกัด,www.tcp.com,info@tcp.com,02-4150100
บริษัท ทีที แชมป์เปี้ยน(ประเทศไทย) จำกัด,https://ttchampion.co.th/th-Contactus/th.html,info@ttchampion.co.th,038-219045
บริษัท นคร แคปปิตอล จำกัด,https://www.nakorncapital.co.th,admin@nakorncapital.co.th,061-1788122
บริษัท นวัตกรรมการแพทย์แผนไทย จำกัด,https://ttmic.co.th/,ttmic2020@gmail.com,094-4299624
บริษัท นำคนต่างด้าวมาทำงานในประเทศ สยามตรีทศ ซัพพลายส์ จำกัด,https://stt.in.th/,mou@lpsgoup.co.th,02-3381712-3
บริษัท นิวเจน อีเนอจี้ โซลูชั่น จำกัด,www.ngesth.com,sales@ngesth.com,02-1148163
บริษัท บราวน์ ยูไนเต็ด จำกัด,https://browneandco.com/,browne.united@gmail.com,02-6793277
บริษัท บริหารสินทรัพย์แคปปิตอลชัวร์ จำกัด,https://capitalsure-amc.com/,account2@capitalsure-amc.com,095-5452556
บริษัท บอดี้ จูน คอร์ปอเรชั่น จำกัด,https://www.bodytune.co.th/,,02-0277887
บริษัท บอนทิไลฟ์ จำกัด,https://bontilife.com/,info@bontilife.com,02-1252761
บริษัท บ้านฉัน ลีฟวิ่ง พอยท์  จำกัด,https://baanchan.co.th/home-onepage-light/,contact@baanchan.co.th,099-7896362
บริษัท บี-เมด เอ็กซ์ จำกัด,www.beaut-app.com,support@beaut-app.com,02-3671111
บริษัท บีกรีน ไบโอเทค จำกัด,https://www.begreenbio.co.th/,hello@begreenbio.co.th,02-0786171
บริษัท ปภพ โซลาร์ จำกัด,https://www.papopsolar.com/th#sec8aik,info@papopsolar.com,02-5705580
บริษัท ปัญญาประเสริฐกุล จำกัด,www.gtech.ac.th/,gtech2559@gmail.com,043-313234
บริษัท ปันปันเวิร์ล จำกัด,https://panpanworld.co.th/,contact@panpanworld.co.th,02-0966388
บริษัท พัฒน์พิบูล สตีล บาร์ มิล จำกัด,https://tnp.co.th/,info@tnp.co.th,02-6188999
บริษัท พัทยา สเตชั่น รูม จำกัด,www.bluebedpattaya.com,bluebedpattaya@gmail.com,092-4050404
บริษัท พีเค. อินโนฟู้ดส์ จำกัด,https://pk-innofoods.com/,pinit@pk-innofoods.com,02-1572018
บริษัท พีเอส-มาคุอะเกะ จำกัด,https://psmakuake.com/,support@psmakuake.com,064-3472619
บริษัท ฟูลเทค เทคโนโลยี (ไทยแลนด์) จำกัด,https://www.sicworld.com,,02-1085511
บริษัท มั่งมี เอพลัส จำกัด,https://www.mungmeeaplus.com/,,065-0356999
บริษัท มิตรอน ซีอี  จำกัด,http://www.mitron-ce.com/index.php,mitron.ce@gmail.com,02-4310010
บริษัท มีสเปซ เซลฟ์ สโตเรจ (รามอินทรา)  จำกัด,www.mespace-selfstorage.co.th,skt@mespace.storage,02-7104081
บริษัท รอยัล รีซอสเซส รีบอร์น จำกัด,https://www.rene.co.th/,info@rene.co.th,061-2619959
บริษัท รอยัล สมุยกอล์ฟ แอนด์ คันทรี่คลับ จำกัด,www.rsgcc.co.th,bookings@rsgcc.co.th,077-458449
บริษัท รีไซเคิลเดย์ จำกัด,www.recycledaythailand.com,recycledaythailand@gmail.com,02-6616603-10
บริษัท รีกัล พรีเชียส เมททอล อินโนเวชั่น จำกัด,https://www.regalpreciousmetal.com/th,inquiry@regalpreciousmetal.com,02-4204022
บริษัท ล็อกซ์เทรด สเปเชียลตี้ อินโนเวชั่น จำกัด,https://www.loxley.co.th/,info@loxley.co.th,02-3488000
บริษัท ลองสเตย์ คอนซัลติ้ง (ประเทศไทย) จำกัด,https://longstayconsulting.co.th/,info@longstayconsulting.co.th,02-2586126
บริษัท วอร์นเนอร์ แช็ปเปิล มิวสิค (ประเทศไทย) จำกัด,www.warnermusicthailand.com,warnermusicthailand@gmail.com,02-1063900
บริษัท วีที อินโนเวทีฟ อะไลแอนซ์ จำกัด,https://www.vtinnovative.com/about-us,sale@vtinnovative.com,02-1026290
บริษัท วู้ดเวอร์คฟาร์ม จำกัด,https://www.woodworkgroup.co.th/subsidiaries-th/,itc@woodworkgroup.co.th,075-577260-3
บริษัท ศุภโชคโภคทรัพย์ จำกัด,www.spc-estate.com,info@spc-estate.com,091-7879444
บริษัท สปีดิชั่น ซิกม่า จำกัด,http://www.speditionsigma.com/contact.html,sale@speditionsigma.com,02-7904513
บริษัท สยาม เมดิบ็อท จำกัด,https://siammedibot.com/,contact@siammedibot.com,02-8841185
บริษัท สยาม ซีเพลน จำกัด,https://www.siamseaplane.com/th,contact@siamseaplane.com,02-6664969
บริษัท สยาม ดิจิทัล เลนดิ้ง จำกัด,https://siamdl.co.th/contact-us,support@siamdl.co.th,02-0169300
บริษัท สวีทรานส์ กรุ๊ป จำกัด,https://www.swe-trans.co.th/Home/Index,swe-trans@hotmail.com,02-6174481-2
บริษัท อนุสรณ์ พาวเวอร์เซอร์วิส 3 จำกัด,http://www.anusornpower.com/,admin.apow@gmail.com,034-414161
บริษัท อมตะเฮลท์แคร์ จำกัด,https://amatayawellness.com/,info@amatayawellness.com,02-1099875
บริษัท อินเตอร์ เนชั่นแนล เอ๊าท์ดอร์ มีเดีย จำกัด,https://kongthong-group.com/,info@kongthong-group.com,02-4033270-3
บริษัท อิมเมจ ทรี จำกัด,https://imagetree.co.th/,contact@imagetree.co.th,02-4468133
บริษัท อิริเดซเซ็นท์ เมด จำกัด,https://www.iridescentmed.com/th/,info@iridescentmed.com,083-6888888
บริษัท อีซี่ ดิจิตอล จำกัด,www.eazydigital.io/th,support@eazydigital.io marketing@eazydigital.io,093-8189098
บริษัท อุ่นใจ ออโต้ ลิสซิ่ง จำกัด,http://www.aunjai.co.th/index.php,,042-222418
บริษัท อูดิก้า เค ฟาร์ม จำกัด,https://udicakfarm.com/th,info@udicakfarm.com,081-5253564?
บริษัท ฮับ เฮ็ด ดี จำกัด,www.packkingdee.com,packkingplants@hub-hd.com,082-2466296
ห้างหุ้นส่วนจำกัด โกลเด้นบีช บูติค รีสอร์ท แอนด์ โฮเทล,https://goldenbeachboutique.com/,goldenbeachhostel@hotmail.com,032-601626
ห้างหุ้นส่วนจำกัด โรงเลื่อยจักร ตั้งเต็กเส็ง,https://www.tangtekseng.com,Jatupat.t@gmail.com,086-3928363
ห้างหุ้นส่วนจำกัด ทูเก็ตเตอร์ รีสอร์ท,https://www.together-resort.com,reservation@together-resort.com,032-708888
ห้างหุ้นส่วนจำกัด บรีซฮิลล์เขาค้อ 2011,https://breezehill-khaokho.com/premier-room/,breezehillkhaokho@hotmail.com,056-705929
